{
  "schema_version": "1.0",
  "dataset_id": "ttwo-marketdata-private-normalized-v1",
  "ticker": "TTWO",
  "generated_at": "2026-08-08T00:00:00Z",
  "raw_envelopes": 1998,
  "raw_rows": 46413,
  "unique_observations": 20884,
  "exact_duplicates_removed": 25529,
  "conflicting_observations": 0,
  "requested_date_start": "2025-07-21",
  "requested_date_end": "2026-07-23",
  "quote_time_start": "2025-07-21T20:00:00Z",
  "quote_time_end": "2026-07-23T20:00:00Z",
  "observations_per_requested_date": {
    "2025-07-21": 281,
    "2025-07-22": 23,
    "2025-07-23": 10,
    "2025-07-24": 10,
    "2025-07-25": 10,
    "2025-07-28": 285,
    "2025-07-29": 31,
    "2025-07-30": 12,
    "2025-07-31": 12,
    "2025-08-01": 12,
    "2025-08-04": 301,
    "2025-08-05": 28,
    "2025-08-06": 15,
    "2025-08-07": 15,
    "2025-08-08": 15,
    "2025-08-11": 309,
    "2025-08-12": 45,
    "2025-08-13": 15,
    "2025-08-14": 15,
    "2025-08-15": 15,
    "2025-08-18": 285,
    "2025-08-19": 42,
    "2025-08-20": 13,
    "2025-08-21": 13,
    "2025-08-22": 13,
    "2025-08-25": 289,
    "2025-08-26": 31,
    "2025-08-27": 15,
    "2025-08-28": 15,
    "2025-08-29": 15,
    "2025-09-02": 292,
    "2025-09-03": 42,
    "2025-09-04": 15,
    "2025-09-05": 15,
    "2025-09-08": 15,
    "2025-09-09": 299,
    "2025-09-10": 35,
    "2025-09-11": 12,
    "2025-09-12": 12,
    "2025-09-15": 12,
    "2025-09-16": 291,
    "2025-09-17": 35,
    "2025-09-18": 11,
    "2025-09-19": 11,
    "2025-09-22": 11,
    "2025-09-23": 271,
    "2025-09-24": 44,
    "2025-09-25": 12,
    "2025-09-26": 12,
    "2025-09-29": 12,
    "2025-09-30": 312,
    "2025-10-01": 40,
    "2025-10-02": 13,
    "2025-10-03": 13,
    "2025-10-06": 13,
    "2025-10-07": 310,
    "2025-10-08": 34,
    "2025-10-09": 14,
    "2025-10-10": 14,
    "2025-10-13": 14,
    "2025-10-14": 314,
    "2025-10-15": 40,
    "2025-10-16": 12,
    "2025-10-17": 12,
    "2025-10-20": 12,
    "2025-10-21": 312,
    "2025-10-22": 34,
    "2025-10-23": 9,
    "2025-10-24": 9,
    "2025-10-27": 9,
    "2025-10-28": 314,
    "2025-10-29": 45,
    "2025-10-30": 13,
    "2025-10-31": 13,
    "2025-11-03": 13,
    "2025-11-04": 323,
    "2025-11-05": 36,
    "2025-11-06": 14,
    "2025-11-07": 14,
    "2025-11-10": 14,
    "2025-11-11": 337,
    "2025-11-12": 43,
    "2025-11-13": 11,
    "2025-11-14": 11,
    "2025-11-17": 11,
    "2025-11-18": 317,
    "2025-11-19": 32,
    "2025-11-20": 10,
    "2025-11-21": 10,
    "2025-11-24": 10,
    "2025-11-25": 301,
    "2025-11-26": 39,
    "2025-11-28": 15,
    "2025-12-01": 15,
    "2025-12-02": 15,
    "2025-12-03": 297,
    "2025-12-04": 28,
    "2025-12-05": 14,
    "2025-12-08": 14,
    "2025-12-09": 14,
    "2025-12-10": 290,
    "2025-12-11": 37,
    "2025-12-12": 11,
    "2025-12-15": 11,
    "2025-12-16": 11,
    "2025-12-17": 286,
    "2025-12-18": 38,
    "2025-12-19": 12,
    "2025-12-22": 12,
    "2025-12-23": 12,
    "2025-12-24": 267,
    "2025-12-26": 42,
    "2025-12-29": 12,
    "2025-12-30": 12,
    "2025-12-31": 12,
    "2026-01-02": 275,
    "2026-01-05": 31,
    "2026-01-06": 11,
    "2026-01-07": 11,
    "2026-01-08": 11,
    "2026-01-09": 286,
    "2026-01-12": 36,
    "2026-01-13": 13,
    "2026-01-14": 13,
    "2026-01-15": 13,
    "2026-01-16": 302,
    "2026-01-20": 38,
    "2026-01-21": 13,
    "2026-01-22": 13,
    "2026-01-23": 13,
    "2026-01-26": 269,
    "2026-01-27": 36,
    "2026-01-28": 12,
    "2026-01-29": 12,
    "2026-01-30": 12,
    "2026-02-02": 324,
    "2026-02-03": 38,
    "2026-02-04": 10,
    "2026-02-05": 10,
    "2026-02-06": 10,
    "2026-02-09": 316,
    "2026-02-10": 27,
    "2026-02-11": 3,
    "2026-02-12": 3,
    "2026-02-13": 3,
    "2026-02-17": 321,
    "2026-02-18": 24,
    "2026-02-19": 13,
    "2026-02-20": 13,
    "2026-02-23": 13,
    "2026-02-24": 305,
    "2026-02-25": 40,
    "2026-02-26": 15,
    "2026-02-27": 15,
    "2026-03-02": 15,
    "2026-03-03": 303,
    "2026-03-04": 34,
    "2026-03-05": 14,
    "2026-03-06": 14,
    "2026-03-09": 14,
    "2026-03-10": 293,
    "2026-03-11": 45,
    "2026-03-12": 10,
    "2026-03-13": 10,
    "2026-03-16": 10,
    "2026-03-17": 290,
    "2026-03-18": 35,
    "2026-03-19": 10,
    "2026-03-20": 10,
    "2026-03-23": 10,
    "2026-03-24": 263,
    "2026-03-25": 43,
    "2026-03-26": 11,
    "2026-03-27": 11,
    "2026-03-30": 11,
    "2026-03-31": 289,
    "2026-04-01": 40,
    "2026-04-02": 11,
    "2026-04-06": 11,
    "2026-04-07": 11,
    "2026-04-08": 297,
    "2026-04-09": 41,
    "2026-04-10": 11,
    "2026-04-13": 11,
    "2026-04-14": 11,
    "2026-04-15": 307,
    "2026-04-16": 40,
    "2026-04-17": 11,
    "2026-04-20": 11,
    "2026-04-21": 11,
    "2026-04-22": 315,
    "2026-04-23": 36,
    "2026-04-24": 11,
    "2026-04-27": 11,
    "2026-04-28": 11,
    "2026-04-29": 312,
    "2026-04-30": 56,
    "2026-05-01": 17,
    "2026-05-04": 13,
    "2026-05-05": 13,
    "2026-05-06": 297,
    "2026-05-07": 53,
    "2026-05-08": 8,
    "2026-05-11": 4,
    "2026-05-12": 4,
    "2026-05-13": 349,
    "2026-05-14": 45,
    "2026-05-15": 21,
    "2026-05-18": 13,
    "2026-05-19": 13,
    "2026-05-20": 382,
    "2026-05-21": 57,
    "2026-05-22": 20,
    "2026-05-26": 12,
    "2026-05-27": 12,
    "2026-05-28": 422,
    "2026-05-29": 42,
    "2026-06-01": 8,
    "2026-06-02": 8,
    "2026-06-03": 8,
    "2026-06-04": 466,
    "2026-06-05": 48,
    "2026-06-08": 12,
    "2026-06-09": 12,
    "2026-06-10": 12,
    "2026-06-11": 498,
    "2026-06-12": 44,
    "2026-06-15": 10,
    "2026-06-16": 10,
    "2026-06-17": 10,
    "2026-06-18": 507,
    "2026-06-22": 41,
    "2026-06-23": 8,
    "2026-06-24": 8,
    "2026-06-25": 36,
    "2026-06-26": 544,
    "2026-06-29": 34,
    "2026-06-30": 12,
    "2026-07-01": 12,
    "2026-07-02": 40,
    "2026-07-06": 491,
    "2026-07-07": 49,
    "2026-07-08": 11,
    "2026-07-09": 11,
    "2026-07-10": 15,
    "2026-07-13": 11,
    "2026-07-14": 23,
    "2026-07-16": 126,
    "2026-07-17": 97,
    "2026-07-23": 1024
  },
  "non_null_field_counts": {
    "bid": 20884,
    "ask": 20884,
    "mid": 20884,
    "volume": 20884,
    "open_interest": 20884,
    "underlying_price": 20884,
    "implied_volatility": 0,
    "delta": 0,
    "gamma": 0,
    "vega": 0,
    "theta": 0,
    "rho": 0
  },
  "quality_flag_counts": {
    "vendor_analytics_unavailable": 20884
  },
  "dataset_hash": "913c99a35a2a33b142fc04f342ee6938ad7c22226d0990a60bc5e4235c3cf221",
  "normalized_location": "local_private",
  "raw_data_committed": false,
  "availability_policy": "Conservative research convention: available_at = quote_time + 24 hours; configurable and sensitivity-tested.",
  "order_capability": "forbidden",
  "limitations": [
    "Historical EOD quotes are not evidence of simultaneous executable fills.",
    "Vendor IV and Greeks are absent and remain null at normalization.",
    "Raw and normalized licensed observations remain local and are not committed."
  ]
}
